Title,Abstract
Identifying side effects of commonly used drugs in the treatment of Covid 19.,"To increase the success in Covid 19 treatment, many drug suggestions are presented, and some clinical studies are shared in the literature. There have been some attempts to use some of these drugs in combination. However, using more than one drug together may cause serious side effects on patients. Therefore, detecting drug-drug interactions of the drugs used will be of great importance in the treatment of Covid 19. In this study, the interactions of 8 drugs used for Covid 19 treatment with 645 different drugs and possible side effects estimates have been produced using Graph Convolutional Networks. As a result of the experiments, it has been found that the hematopoietic system and the cardiovascular system are exposed to more side effects than other organs. Among the focused drugs, Heparin and Atazanavir appear to cause more adverse reactions than other drugs. In addition, as it is known that some of these 8 drugs are used together in Covid-19 treatment, the side effects caused by using these drugs together are shared. With the experimental results obtained, it is aimed to facilitate the selection of the drugs and increase the success of Covid 19 treatment according to the targeted patient."
The Potential Mechanism of N-acetylcysteine in Treating COVID-19.,"N-Acetylcysteine (NAC) has been proposed to be used to treat Coronavirus Disease 2019 (COVID-19). By reviewing the existing pathological studies of COVID-19, it was found that abundant mucus secretion, formation of a hyaline membrane (supportive of acute respiratory distress syndrome), and interstitial fibrous exudation may be important characteristics of COVID-19 and pathological targets of drug therapy. In addition, multiple extrapulmonary organ injuries in COVID- 19 may be associated with cytokine storm. NAC is an important antioxidant and anti-inflammatory drug. NAC has been demonstrated to have mucolytic effects in bronchitis, relieve respiratory failure in acute respiratory distress syndrome, and inhibit fibrous exudation in interstitial lung disease in clinical studies. These findings suggest that NAC may have a therapeutic effect on the pathological targets of COVID-19. Furthermore, NAC decreases TNF-alpha, IL-1beta, IL-6, IL-8, IL-10, and IL-17 serum levels in patients with sepsis, severe burns, acute liver failure, or peritoneal dialysis and may also reduce cytokine storm in COVID-19. The antiviral effect of NAC on other respiratory viruses may also benefit COVID-19 patients. Summarizing the potential mechanisms of NAC in treating COVID-19 suggests that the role of NAC in COVID-19 treatment is worthy of further research."
Hydroxychloroquine for the treatment of COVID-19 and its potential cardiovascular toxicity: Hero or villain?,"A variety of treatment modalities have been investigated since the beginning of the Coronavirus Disease-19 (COVID-19) pandemic. The use of antimalarials (hydroxychloroquine and chloroquine) for COVID-19 treatment and prevention has proven to be a cautionary tale for widespread, off-label use of a medication during a crisis. The investigation of antimalarials for COVID-19 has also been a driver for a deluge of scientific output in a short amount of time. In this narrative review, we detail the evidence for and against antimalarial use in COVID-19, starting with the early small observational studies that influenced strategies worldwide. We then contrast these findings to later published larger observational studies and randomized controlled trials. We detail the emerging possible cardiovascular risks associated with antimalarial use in COVID-19 and whether COVID-19-related outcomes and cardiovascular risks may differ for antimalarials used in rheumatic diseases."
Efficacy of Dexamethasone for the Treatment of COVID-19 Infection: A Perspective Review.,"The current COVID-19 pandemic has provoked the urgent requirement to search for effective treatments since the implications are so huge globally as compared to the earlier pandemics. Momentarily, there has been no effective medicine for SARS-CoV-2 infection, and supportive care tends to be the most effective approach to treat COVID-19 patients. The rapidly growing awareness of SARS-CoV-2 virology offers a large number of possible drug targets. The World Health Organisation (WHO) is steadily updating the treatment protocol for COVID-19 based on the recent clinical trials. In the present review, we have summarised the possible mode of action, clinical evidence, consequences of dexamethasone as the therapeutic agent against Covid-19. Currently, many corticosteroids are being tested in ongoing randomised trials. Dexamethasone could come as the life-saving drug. Dexamethasone drug looks useful only in those patients who are already in a critical state. We might allow dexamethasone as a fascinating shot, if the drug proves to be clinically favourable for long-term health effects of Covid-19 recovered patients. It is commonly accepted to reinforce approved drugs in the fight against newly emerging diseases such as COVID-19 as these drugs have established pharmacokinetic profiles and protection. The current focus should be on the development of novel proven therapeutics along with vaccines. There is a need for high quality, more extensive, rapid and collaborative randomized controlled trials with more control groups."
Human Monoclonal Antibodies: On the Menu of Targeted Therapeutics Against COVID-19.,"Coronavirus disease 2019 (COVID-19), reminiscent of the severe acute respiratory syndrome (SARS) outbreak in 2003, has been a tragic disaster to people all over the world. As there is no specific drug for COVID-19, neutralizing antibodies are attracting more and more attention as one of the most effective means to combat the pandemic. Here, we introduced the etiological and serological characteristics of COVID-19, discussed the current stage of development of human monoclonal antibodies against SARS-CoV-2 and summarized the antigenic epitopes in the S glycoprotein, which may deepen the understanding of the profile of immune recognition and response against SARS-CoV-2 and provide insight for the design of effective vaccines and antibody-based therapies."
A pharmacology-based comprehensive review on medicinal plants and phytoactive constituents possibly effective in the management of COVID-19.,"Arisen in China, COVID-19 (SARS-CoV-II) is a novel coronavirus that has been expanding fast worldwide. Till now, no definite remedial drug or vaccine has been identified for COVID-19 treatment. Still, for a majority of infected patients, supportive therapy is the cornerstone of the management plan. To the importance of managing the COVID-19 pandemic, this article proposed to collecting capable medicinal plants and bioactive components in both treat and supportive therapy of this novel viral infection. Clinical points in the pathogenesis, symptoms, and complications of COVID-19 were considered. The effective plants and bioactives that may play a role in supportive therapy/management of COVID-19 were searched, collected through the ""Scopus"" database and listed in three sections. Numerous medicinal plants such as Citrus Spp., Camellia sinensis, and Glycyrrhiza glabra can interference with COVID-19 pathogenesis via inhibition of virus replication and entry to its host cells. Also, some anti-inflammatory herbal medicine such as Andrographis paniculata, Citrus spp., and Cuminum cyminum can relieve fever and cough in COVID-19 patients. Medicinal plants such as G. glabra, Thymus vulgaris, Allium sativum, Althea officinalis, and Panax ginseng may modulate the immune system and possess prevention and supportive therapy. However, more clinical data are required to confirm these hypotheses."
Stem Cell Therapy: A Promising Approach in Treatment of COVID-19.,"COVID-19 pandemic is a global health crisis of the 21st Century. There are currently no approved vaccines and no particular anti-viral treatment for coronavirus disease. As COVID-19 has a broad range of illnesses, it is necessary to find a safe and effective therapeutic method for COVID-19. An attractive approach for treating COVID-19 is cell therapy. Cell therapy aims to inject new and healthy stem cells into a patient's body, to repair the damaged cells and tissues. Stem cell therapy is one of the most studied and important approaches in the treatment of COVID-19 these days. The significant clinical outcome was observed by the adoptive transfer of stem cells, specifically mesenchymal stem cells. This study reviews the characteristics of stem cells and clinical trials that have used stem cells in treating COVID-19."
Drug-drug interactions between COVID-19 treatments and antipsychotics drugs: integrated evidence from 4 databases and a systematic review.,"RATIONALE: Management of anxiety, delirium, and agitation cannot be neglected in coronavirus disease (COVID-19). Antipsychotics are usually used for the pharmacological management of delirium, and confusion and behavioral disturbances. The concurrent use of treatments for COVID-19 and antipsychotics should consider eventual drug-drug interactions OBJECTIVE: To systematically review evidence-based available on drug-drug interactions between COVID-19 treatments and antipsychotics. EVIDENCE REVIEW: Three databases were consulted: Lexicomp(R) Drug Interactions, Micromedex(R) Solutions Drugs Interactions, and Liverpool(c) Drug Interaction Group for COVID-19 therapies. To acquire more information on QT prolongation and Torsade de Pointes (TdP), the CredibleMeds(R) QTDrugs List was searched. The authors made a recommendation agreed to by consensus. Additionally, a systematic review of drug-drug interactions between antipsychotics and COVID-19 treatment was conducted. RESULTS: The main interactions between COVID-19 drugs and antipsychotics are the risk of QT-prolongation and TdP, and cytochromes P450 interactions. Remdesivir, baricinitib, and anakinra can be used concomitantly with antipsychotics without risk of drug-drug interaction (except for hematological risk with clozapine and baricinitib). Favipiravir only needs caution with chlorpromazine and quetiapine. Tocilizumab is rather safe to use in combination with antipsychotics. The most demanding COVID-19 treatments for coadministration with antipsychotics are chloroquine, hydroxychloroquine, azithromycin, and lopinavir/ritonavir because of the risk of QT prolongation and TdP and cytochromes interactions. The systematic review provides highly probable drug interaction between lopinavir/ritonavir plus quetiapine and ritonavir/indinavir plus risperidone. CONCLUSIONS: Clinicians prescribing antipsychotics should be aware of the likely risk of drug-drug interaction with COVID-19 medication and may benefit from taking into account present recommendations of use to preserve patient safety."
"Network pharmacology analysis of the therapeutic mechanisms of the traditional Chinese herbal formula Lian Hua Qing Wen in Corona virus disease 2019 (COVID-19), gives fundamental support to the clinical use of LHQW.","BACKGROUND: The traditional Chinese Medicine (TCM) herbal formula Lian Hua Qing Wen (LHQW) improves the results of COVID-19 treatment. Three very recent studies analyzed with network pharmacology some working mechanisms of LHQW. However, we used more techniques and also included Angiotensin converting enzyme 2 (ACE2) (a SARS-CoV receptor, possibly the viral entry point in alveolar lung cells) and the immune system, as cytokine storm is essential in the late phase. PURPOSE: Extensive detailed Network Pharmacology analysis of the LHQW- treatment mechanism in COVID-19. METHODS: TCM-herb-meridian and protein interaction network (PIN) of LHQW, based on LHQW herbs meridian information and the protein-protein interaction (PPI) information of the LHQW-component targets. Hub and topological property analyses to obtain crucial targets and construct the crucial LHQW-PIN. Functional modules determination using MCODE, GO and KEGG pathway analysis of biological processes and pathway enrichment. Intersection calculations between the LHQW-proteins and ACE2 co-expression-proteins. RESULTS: LHQW herbs have relationships to Stomach-, Heart-, Liver- and Spleen-systems, but most (10 of the 13 herbs) to the Lung system, indicating specific effects in lung diseases. The crucial LHQW PIN has the scale-free property, contains 2,480 targets, 160,266 PPIs and thirty functional modules. Six modules are enriched in leukocyte-mediated immunity, the interferon-gamma-mediated signaling pathway, immune response regulating signaling pathway, interleukin 23 mediated signaling pathway and Fc gamma receptor-mediated phagocytosis (GO analysis). These 6 are also enriched in cancer, immune system-, and viral infection diseases (KEGG). LHQW shared 189 proteins with ACE2 co-expression proteins. CONCLUSIONS: Detailed network analysis shows, that LHQW herbal TCM treatment modulates the inflammatory process, exerts antiviral effects and repairs lung injury. Moreover, it also relieves the ""cytokine storm"" and improves ACE2-expression-disorder-caused symptoms. These innovative findings give a rational pharmacological basis and support for treating COVID-19 and possibly other diseases with LHQW."
"Early experimental COVID-19 therapies: associations with length of hospital stay, mortality and related costs.","AIMS OF THE STUDY: Hydroxychloroquine and lopinavir/ritonavir have been used as experimental therapies to treat COVID-19 during the first wave of the pandemic. Randomised controlled trials have recently shown that there are no meaningful benefits of these two therapies in hospitalised patients. Uncertainty remains regarding the potential harmful impact of these therapies as very early treatments and their burden to the health care system. The present study investigated the length of hospital stay (LOS), mortality, and costs of hydroxychloroquine, lopinavir/ritonavir or their combination in comparison with standard of care among patients hospitalised for coronavirus disease 2019 (COVID-19). METHODS: This retrospective observational cohort study took place in the Geneva University Hospitals, Geneva, Switzerland (n = 840) between 26 February and 31 May 2020. Demographics, treatment regimens, comorbidities, the modified National Early Warning Score (mNEWS) on admission, and contraindications to COVID-19 treatment options were assessed. Outcomes included LOS, in-hospital mortality, and drug and LOS costs. RESULTS: After successful propensity score matching, patients treated with (1) hydroxychloroquine, (2) lopinavir/ritonavir or (3) their combination had on average 3.75 additional hospitalisation days (95% confidence interval [CI] 1.37&ndash;6.12, p = 0.002), 1.23 additional hospitalisation days (95% CI &minus;1.24 &ndash; 3.51, p = 0.319), and 4.19 additional hospitalisation days (95% CI 1.52&ndash;5.31, p &lt;0.001), respectively, compared with patients treated with the standard of care. Neither experimental therapy was significantly associated with mortality. These additional hospital days amounted to 1010.77 additional days for hydroxychloroquine and hydroxychloroquine combined with lopinavir/ritonavir, resulting in an additional cost of US$ 2,492,214 (95%CI US$ 916,839&ndash;3,450,619). CONCLUSIONS: Prescribing experimental therapies for COVID-19 was not associated with a reduced LOS and might have increased the pressure put on healthcare systems."
"COVID-19 associated coagulopathy: Thrombosis, hemorrhage and mortality rates with an escalated-dose thromboprophylaxis strategy.",
The shortcomings of tocilizumab in COVID-19.,
"COVID-19, host response treatment, and the need for political leadership.","Health officials and scientists have warned that we face the threat of a potentially devastating influenza pandemic. Instead, we are now in the midst of a global coronavirus (COVID-19) pandemic. National and international pandemic preparedness plans have focused on developing vaccines and antiviral treatments. Another way to confront the COVID-19 pandemic (and future pandemics) might be to treat patients with inexpensive and widely available generic drugs that target the host response to infection, not the virus itself. The feasibility of this idea was tested during the Ebola outbreak in West Africa in 2014. This experience should inform our approach to treating COVID-19 patients. It could also save lives during outbreaks of other emerging infectious diseases and episodes of everyday acute critical illness. If this ""bottom up"" syndromic approach to treating acute critical illness were shown to be effective, it could have a dramatic impact on health, equity and security throughout the world. HIGHLIGHTS: Uncertainty about the outcome of COVID-19 is driving the social, economic and political distress associated with the pandemic. Treating the host response to COVID-19 with inexpensive and widely available generic drugs might save lives and mitigate this distress. Undertaking research on this idea will require political leadership."
A Narrative Review of Pharmacologic Treatments for COVID-19: Safety Considerations and Ototoxicity.,"OBJECTIVE/HYPOTHESIS: The purpose of this review is to summarize evidence-based data regarding the ototoxic effects of potential COVID-19 therapeutics to treat patients suffering from SARS-CoV-2. METHODS: Medications under investigation as novel therapeutics to treat COVID-19 were identified using the search term coronavirus therapeutics, COVID therapeutics, and SARS-CoV-2 therapeutics on ClinicalTrials.gov and the PubMed Database. A literature review was performed using the PubMed Database for each proposed COVID-19 therapeutic to identify relevant articles. Search criteria included Medical Subject Headings (MeSH) and key word search terms for ototoxicity, vestibulotoxicity, hearing disorders, and vertigo. RESULTS: Six proposed COVID-19 therapeutics were identified as possessing ototoxic side effects including chloroquine and hydroxychloroquine, azithromycin, lopinavir-ritonavir, interferon, ribavirin, and ivermectin. CONCLUSIONS: Available evidence suggests that ototoxic effects may be improved or mitigated by stopping the offending agent. Recognition of hearing loss, tinnitus, or imbalance/vertigo is therefore crucial to facilitate early intervention and prevent long-term damage. Hospitals should consider the inclusion of audiologic monitoring protocols for patients receiving COVID-19 therapeutics with known ototoxicity, especially in high-risk patient groups such as the elderly and hearing impaired. Laryngoscope, 131:1626-1632, 2021."
Use of medicines for covid-19 treatment in patients with loss of kidney function: a narrative review.,"Covid-19 has been identified as the cause of acute respiratory disease with interstitial and alveolar pneumonia, but it can affect several organs, such as kidneys, heart, blood, nervous system and digestive tract. The disease-causing agent (Sars-CoV-2) has a binding structure to the angiotensin-converting enzyme 2 (ACE2) receptor, enabling entry into cells that express ACE2, such as the pulmonary alveolar epithelial cells. However, studies also indicate the possibility of damage to renal cells, since these cells express high levels of ACE2. Currently, there is no evidence to indicate a specific treatment for covid-19. Several drugs have been used, and some of them may have their excretion process altered in patients with abnormal kidney function. To date, there are no studies that assist health professionals in adjusting the dose of these drugs. Thus, this study aims to review and discuss the topic, taking into account factors associated with kidney injury in covid-19, as well as pharmacokinetic aspects and dose recommendations of the main drugs used for covid-19."
Chloroquine and Hydroxychloroquine for the Treatment of COVID-19: Review and Appraisal of Current Evidence.,"Novel severe acute respiratory syndrome coronavirus 2 (SARS-CoV-2) and associated coronavirus disease 19 (COVID-19) began ravaging most of the globe in November 2019. In the United States more than 25 million people have been infected with SARS-CoV-2. To date, COVID-19 has killed close to 400,000 U.S. citizens. In the face of limited pharmacotherapies, the current burden of SARS-CoV-2 and COVID-19 signals overwhelming sickness and trillions in healthcare costs ahead. The need to expeditiously identify safe and efficacious prophylaxis and treatment options is critical. Drug repositioning may be a promising strategy toward mitigating the impact of SARS-CoV-2 and COVID-19. This rapid review appraises available evidence on the viability of vintage antimalarial drugs chloroquine (CHQ) and its analog hydroxychloroquine (HCQ) repositioned for SARS-CoV-2 prophylaxis and COVID-19 treatment. Findings suggest neither the use of CHQ nor HCQ singularly, or concomitantly, with azithromycin and/or zinc provide definitive benefits for use against SARS-CoV-2 infection or COVID-19 illness. Moreover, administration of these medications was linked to significant and sometimes fatal complications."
