Title,Abstract
Drug-drug interactions with candidate medications used for COVID-19 treatment: An overview.,"Drug-drug interaction (DDI) is a common clinical problem that has occurred as a result of the concomitant use of multiple drugs. DDI may occur in patients under treatment with medications used for coronavirus disease 2019 (COVID-19; i.e., chloroquine, lopinavir/ritonavir, ribavirin, tocilizumab, and remdesivir) and increase the risk of serious adverse reactions such as QT-prolongation, retinopathy, increased risk of infection, and hepatotoxicity. This review focuses on summarizing DDIs for candidate medications used for COVID-19 in order to minimize the adverse reactions."
Nano-Biomimetic Drug Delivery Vehicles: Potential Approaches for COVID-19 Treatment.,"The current COVID-19 pandemic has tested the resolve of the global community with more than 35 million infections worldwide and numbers increasing with no cure or vaccine available to date. Nanomedicines have an advantage of providing enhanced permeability and retention and have been extensively studied as targeted drug delivery strategies for the treatment of different disease. The role of monocytes, erythrocytes, thrombocytes, and macrophages in diseases, including infectious and inflammatory diseases, cancer, and atherosclerosis, are better understood and have resulted in improved strategies for targeting and in some instances mimicking these cell types to improve therapeutic outcomes. Consequently, these primary cell types can be exploited for the purposes of serving as a ""Trojan horse"" for targeted delivery to identified organs and sites of inflammation. State of the art and potential utilization of nanocarriers such as nanospheres/nanocapsules, nanocrystals, liposomes, solid lipid nanoparticles/nano-structured lipid carriers, dendrimers, and nanosponges for biomimicry and/or targeted delivery of bioactives to cells are reported herein and their potential use in the treatment of COVID-19 infections discussed. Physicochemical properties, viz., hydrophilicity, particle shape, surface charge, composition, concentration, the use of different target-specific ligands on the surface of carriers, and the impact on carrier efficacy and specificity are also discussed."
Challenges in COVID-19 drug treatment in patients with advanced liver diseases: A hepatology perspective.,"The global incidence of coronavirus disease 2019 (COVID-19) continues to increase despite health care efforts. The disease is caused by coronavirus 2 with high transmission and mortality rates. Little is known about the management of COVID-19 in advanced liver disease. The aim of work was to propose a plan for management of this drastic disease in case of this specific population with review of medications that could be suitable for advanced liver disease. All the guidelines and medications available for treatment of COVID-19 were reviewed with selection of the less toxic medications that could be used in advanced liver disease. Drugs suitable to manage COVID-19 in patients with liver disease might include remdesivir intravenously, nitazoxanide + sofosbuvir, ivermectin, tocilizumab, convalescent plasma, and low molecular weight heparin in certain situations. Advanced liver disease is associated with portal hypertension and splenomegaly with reduction of blood elements and immune dysfunction and impaired T cell function. Thus, when confronted by cytokine storm as an immune response to COVID-19, there may be an increase in the mortality rate of these patients. Through this review, a plan to treat COVID-19 in this special group of patients with advanced cirrhosis is proposed."
Tackling COVID-19 Using Remdesivir and Favipiravir as Therapeutic Options.,"The human world is currently influenced largely by the outbreak of pandemic COVID-19. At this moment, most researchers focus on developing treatment strategies and measures to work against COVID-19. Treatment strategies specific for COVID-19 are lacking. This article provides an overview of the life cycle and routes of transmission of SARS-CoV-2. The therapeutic effects of two drugs [i. e., remdesivir (RDV) and favipiravir (FPV)] which can potentially tackle COVID-19 are discussed based on current published data. This review can serve as a reference for future studies."
Could Sumac Be Effective on COVID-19 Treatment?,"Sumac is an herbal product, commonly consumed as a spice and was used for medical treatment for centuries. The phytochemical structure of Sumac was studied extensively, and it was established that the herb contained tannins, polyphenols, flavonoids, organic acids, and essential oils. Various scientific studies demonstrated that Sumac had a free oxygen radical-scavenging effect, a protective effect against liver damage, antihemolytic, leukopenia, and antifibrogenic effects, along with its antiviral, antimicrobial, anti-inflammatory, and antioxidant properties. Recently, several scientific studies described the pathophysiology, clinical course, and the treatment of COVID-19 infection. The examination of the characteristics of COVID-19 infection revealed via the clinical studies suggests that Sumac extract could be useful in the treatment of COVID-19. Given the scientific studies focusing on the beneficial effects of Sumac, the present review aims to provide an encouraging viewpoint to investigate whether Sumac is effective in treating COVID-19 infection."
Micronutrients and bioactive substances: Their potential roles in combating COVID-19.,"OBJECTIVES: The coronavirus disease 2019 (COVID-19) pandemic is seriously threatening public health and setting off huge economic crises across the world. In the absence of specific drugs for COVID-19, there is an urgent need to look for alternative approaches. Therefore, the aim of this paper was to review the roles of micronutrients and bioactive substances as potential alternative approaches in combating COVID-19. METHODS: This review was based on the literature identified using electronic searches in different databases. RESULTS: Vitamins (A, B, C, D, and E), minerals (selenium and zinc), and bioactive substances from curcumin, echinacea, propolis, garlic, soybean, green tea, and other polyphenols were identified as having potential roles in interfering with spike glycoproteins, angiotensin converting enzyme 2, and transmembrane protease serine 2 at the entry site, and inhibiting activities of papain-like protease, 3 chymotrypsin-like protease, and RNA-dependent RNA polymerase in the replication cycle of severe acute respiratory syndrome coronavirus 2. Having immunomodulating, antiinflammatory, antioxidant, and antiviral properties, such micronutrients and bioactive substances are consequently promising alterative nutritional approaches to combat COVID-19. CONCLUSIONS: The roles of micronutrients and bioactive substances in the fight against COVID-19 are exciting areas of research. This review may suggest directions for further study."
Efficacy and safety of tocilizumab in COVID-19 patients: a living systematic review and meta-analysis.,"OBJECTIVES: Cytokine release syndrome with elevated interleukin-6 (IL-6) levels is associated with multiorgan damage and death in severe coronavirus disease 2019 (COVID-19). Our objective was to perform a living systematic review of the literature concerning the efficacy and toxicity of the IL-6 receptor antagonist tocilizumab in COVID-19 patients. METHODS: Data sources were Ovid MEDLINE(R) and Epub Ahead of Print, In-Process & Other Non-Indexed Citations and Daily, Ovid Embase, Ovid Cochrane Central Register of Controlled Trials, Ovid Cochrane Database of Systematic Reviews, Web of Science, Scopus up, preprint servers and Google up to October 8, 2020. Study eligibility criteria were randomized controlled trials (RCTs) and observational studies at low or moderate risk of bias. Participants were hospitalized COVID-19 patients. Interventions included tocilizumab versus placebo or standard of care. We pooled crude risk ratios (RRs) of RCTs and adjusted RRs from cohorts, separately. We evaluated inconsistency between studies with I(2). We assessed the certainty of evidence using the GRADE approach. RESULTS: Of 1156 citations, 24 studies were eligible (five RCTs and 19 cohorts). Five RCTs at low risk of bias, with 1325 patients, examined the effect of tocilizumab on short-term mortality; pooled RR was 1.09 (95%CI 0.80-1.49, I(2) = 0%). Four RCTs with 771 patients examined the effect of tocilizumab on risk of mechanical ventilation; pooled RR was 0.71 (95%CI 0.52-0.96, I(2) = 0%), with a corresponding number needed to treat of 17 (95%CI 9-100). Among 18 cohorts at moderate risk of bias with 9850 patients, the pooled adjusted RR for mortality was 0.58 (95%CI 0.51-0.66, I(2) = 2.5%). This association was observed over all degrees of COVID-19 severity. Data from the RCTs did not show a higher risk of infections or adverse events with tocilizumab: pooled RR 0.63 (95%CI 0.38-1.06, five RCTs) and 0.83 (95%CI 0.55-1.24, five RCTs), respectively. CONCLUSIONS: Cumulative moderate-certainty evidence shows that tocilizumab reduces the risk of mechanical ventilation in hospitalized COVID-19 patients. While RCTs showed that tocilizumab did not reduce short-term mortality, low-certainty evidence from cohort studies suggests an association between tocilizumab and lower mortality. We did not observe a higher risk of infections or adverse events with tocilizumab use. This review will continuously evaluate the role of tocilizumab in COVID-19 treatment."
Administration of intravenous immunoglobulin in the treatment of COVID-19: A review of available evidence.,"Since December 31, 2019, unknown causes of pneumonia have been reported in Wuhan, China. This special pneumonia associated with a novel coronavirus was named 2019-nCoV by the World Health Organization (WHO) in January 2020. From the beginning of this infectious disease, clinicians and researchers have been endeavoring to discover an effective and suitable treatment for affected patients. To date, there is no definitive and specific treatments for coronavirus disease-19 (COVID-19) infection while drugs introduced are still in the clinical trial phase. Intravenous immune globulin (IVIG) is a biological product prepared from the serum and an optional treatment for patients with antibody deficiencies. In many countries, much attention has been paid to the use of IVIG in the treatment of patients with COVID-19. Due to the therapeutic importance of IVIG in virus infections, in the current study, we reviewed the possible effect of IVIG in viral infections and potential evidence of IVIG therapy in patients with COVID-19 virus."
Assessment of COVID-19 Treatment containing both Hydroxychloroquine and Azithromycin: A natural clinical trial.,"The goal of this study was to assess the clinical effectiveness and safety profile of the COVID-19 treatment protocol (containing both hydroxychloroquine (HCQ) and azithromycin) in an Iraqi specialised hospital. METHODS: This prospective study used a pre- and post-intervention design without a comparison group. The intervention was routine Ministry of Health (MOH) approved the management of COVID-19 for all patients. The study was conducted in a public healthcare setting in Baghdad, Iraq from March 1st to May 25, 2020. The study outcome measures included the changes in clinical and biochemical parameters during the hospitalisation period. Paired t-test and Chi-square test were used to compare the measures of vital signs, lab tests and symptoms before and after treatment. RESULTS: The study included 161 patients who were admitted with positive RT-PCR and clinical symptoms of COVID-19. In terms of severity, 53 (32.9%) patients had amild condition, 47 (29.2%) had moderate condition, 35 (21.7%) had severe condition and 26 (16.1%) had critical condition. Most patients (84.5%) recovered and were discharged without symptoms after testing negative with RT-PCR, while 11 (6.8%) patients died during the study period. The signs and symptoms of COVID-19 were reduced significantly in response to a therapy regimen containing HCQ and azithromycin. The most common reported side effects were stomach pain, hypoglycemia, dizziness, itching, skin rash, QT prolongation, arrhythmia, and conjunctivitis. CONCLUSIONS: This natural trial showed that the COVID-19 regimen containing both HCQ and azithromycin can be helpful to promote the recovery of most patients and reduced their signs and symptoms significantly. It also shows some manageable side effects mostly those related to heart rhythm. In the absence of FDA-approved medications to treat COVID-19, the repurposing of HCQ and azithromycin to control the disease signs and symptoms can be useful."
Kidney involvement in COVID-19 and its treatments.,"The lungs are the most commonly affected organ by severe acute respiratory syndrome coronavirus 2 (SARS-CoV-2), but the kidneys are also frequently affected. Infection with SARS-CoV-2 can not only cause new kidney damage but also increase the difficulty of treatment and care as well as mortality for people with underlying kidney diseases. Kidney involvement in SARS-CoV-2 infection mainly manifests as kidney tubular injury. Proteinuria is the main clinical sign. To reduce patient mortality, kidney complications should be given increased attention in the diagnosis and treatment of coronavirus disease 2019 (COVID-19). This study reviews the existing literature and discusses COVID-19 infection in combination with kidney diseases in terms of kidney damage, pathogenesis, and treatment to guide clinical anti-epidemic responses."
The use of IV vitamin C for patients with COVID-19: a case series.,"BACKGROUND: The coronavirus disease 2019 (COVID-19) pandemic has affected almost 2.5 million people worldwide with almost 170,000 deaths reported to date. So far, there is scarce evidence for the current treatment options available for COVID-19. Vitamin C has previously been used for treatment of severe sepsis and septic shock. We reviewed the feasibility of using vitamin C in the setting of COVID-19 in a series of patients. METHODS: We sequentially identified a series of patients who were requiring at least 30% of FiO2 or more who received IV vitamin C as part of the COVID-19 treatment and analyzed their demographic and clinical characteristics. We compared inflammatory markers pre and post treatment including D-dimer and ferritin. RESULTS: We identified a total of 17 patients who received IV vitamin C for COVID-19. The inpatient mortality rate in this series was 12% with 17.6% rates of intubation and mechanical ventilation. We noted a significant decrease in inflammatory markers, including ferritin and D-dimer, and a trend to decreasing FiO2 requirements, after vitamin C administration. CONCLUSION: The use of IV vitamin C in patients with moderate to severe COVID-19 disease may be feasible."
The interplay between inflammatory pathways and COVID-19: A critical review on pathogenesis and therapeutic options.,"COVID-19, caused by SARS-CoV-2, emerged as the deadliest outbreak that has now become a serious health issue to mankind. Activation of inflammatory signaling pathways and cytokine storm are crucial factors that lead to acute respiratory distress syndrome (ARDS) in COVID-19 patients. Excessive secretion of pro-inflammatory cytokines and chemokines leads to the dysregulation of the innate immune system. The cytokine storm attracts many inflammatory cells that infiltrate into the lung tissues and ultimately cause immune damage. In addition to the dysregulation of the immune system, dysfunction of the renin-angiotensin system (RAS) due to the downregulation of ACE2 is also associated with the mortality of COVID-19 patients. Both the mechanisms are directly or indirectly associated with cytokine storm that promotes vascular hyperpermeability, vascular edema leading to hypercoagulation and hence multiorgan damage. As of now, there is no specific treatment available for COVID-19, but scientists have purposed several treatment options including cytokine inhibitors, JAK inhibitors, immunomodulators, plasma therapy, etc. In this article, we have provided the detailed mechanism of occurrence of SARS-CoV-2 induced inflammatory storm and its connection with the pre-existing inflammatory conditions. Possible treatment options to cope up with the severe clinical manifestations of COVID-19 are also discussed."
Could cilostazol be beneficial in COVID-19 treatment? Thinking about phosphodiesterase-3 as a therapeutic target.,"Severe acute respiratory syndrome coronavirus 2 (SARS-CoV-2) causes coronavirus disease 2019 (COVID-19) that has emerged and rapidly spread across the world. The COVID-19 severity is associated to viral pneumonia with additional extrapulmonary complications. Hyperinflammation, dysfunctional immune response and hypercoagulability state are associated to poor prognosis. Therefore, the repositioning of multi-target drugs to control the hyperinflammation represents an important challenge for the scientific community. Cilostazol, a selective phosphodiesterase type-3 inhibitor (PDE-3), is an antiplatelet and vasodilator drug, that presents a range of pleiotropic effects, such as antiapoptotic, anti-inflammatory, antioxidant, and cardioprotective activities. Cilostazol also can inhibit the adenosine uptake, which enhances intracellular cAMP levels. In the lungs, elevated cAMP promotes anti-fibrotic, vasodilator, antiproliferative effects, as well as mitigating inflammatory events. Interestingly, a recent study evaluated antiplatelet FDA-approved drugs through molecular docking-based virtual screening on viral target proteins. This study revealed that cilostazol is a promising drug against COVID-19 by inhibiting both main protease (M(pro)) and Spike glycoprotein, reinforcing its use as a promising therapeutic approach for COVID-19. Considering the complexity associated to COVID-19 pathophysiology and observing its main mechanisms, this article raises the hypothesis that cilostazol may act on important targets in development of the disease. This review highlights the importance of drug repurposing to address such an urgent clinical demand safely, effectively and at low cost, reinforcing the main pharmacological actions, to support the hypothesis that a multi-target drug such as cilostazol could play an important role in the treatment of COVID-19."
Review of adverse cutaneous reactions of pharmacologic interventions for COVID-19: A guide for the dermatologist.,"The new coronavirus, severe acute respiratory syndrome coronavirus 2, is associated with a wide variety of cutaneous manifestations. Although new skin manifestations caused by COVID-19 are continuously being described, other cutaneous entities should also be considered in the differential diagnosis, including adverse cutaneous reactions to drugs used in the treatment of COVID-19 infections. The aim of this review is to provide dermatologists with an overview of the cutaneous adverse effects associated with the most frequently prescribed drugs in patients with COVID-19. The skin reactions of antimalarials (chloroquine and hydroxychloroquine), antivirals (lopinavir/ritonavir, ribavirin with or without interferon, oseltamivir, remdesivir, favipiravir, and darunavir), and treatments for complications (imatinib, tocilizumab, anakinra, immunoglobulins, corticosteroids, colchicine and low molecular weight heparins) are analyzed. Information regarding possible skin reactions, their frequency, management, and key points for differential diagnosis are presented."
A systematic review and meta-analysis on chloroquine and hydroxychloroquine as monotherapy or combined with azithromycin in COVID-19 treatment.,"Many recent studies have investigated the role of either Chloroquine (CQ) or Hydroxychloroquine (HCQ) alone or in combination with azithromycin (AZM) in the management of the emerging coronavirus. This systematic review and meta-analysis of either published or preprint observational studies or randomized control trials (RCT) aimed to assess mortality rate, duration of hospital stay, need for mechanical ventilation (MV), virologic cure rate (VQR), time to a negative viral polymerase chain reaction (PCR), radiological progression, experiencing drug side effects, and clinical worsening. A search of the online database through June 2020 was performed and examined the reference lists of pertinent articles for in-vivo studies only. Pooled relative risks (RRs), standard mean differences of 95% confidence intervals (CIs) were calculated with the random-effects model. Mortality was not different between the standard care (SC) and HCQ groups (RR = 0.99, 95% CI 0.61-1.59, I(2) = 82%), meta-regression analysis proved that mortality was significantly different across the studies from different countries. However, mortality among the HCQ + AZM was significantly higher than among the SC (RR = 1.8, 95% CI 1.19-2.27, I(2) = 70%). The duration of hospital stay in days was shorter in the SC in comparison with the HCQ group (standard mean difference = 0.57, 95% CI 0.20-0.94, I(2) = 92%), or the HCQ + AZM (standard mean difference = 0.77, 95% CI 0.46-1.08, I(2) = 81). Overall VQR, and that at days 4, 10, and 14 among patients exposed to HCQ did not differ significantly from the SC [(RR = 0.92, 95% CI 0.69-1.23, I(2) = 67%), (RR = 1.11, 95% CI 0.26-4.69, I(2) = 85%), (RR = 1.21, 95% CI 0.70-2.01, I(2) = 95%), and (RR = 0.98, 95% CI 0.76-1.27, I(2) = 85% )] respectively. Exposure to HCQ + AZM did not improve the VQR as well (RR = 3.23, 95% CI 0.70-14.97, I(2) = 58%). The need for MV was not significantly different between the SC and HCQ (RR = 1.5, 95% CI 0.78-2.89, I(2) = 81%), or HCQ + AZM (RR = 1.27, 95% CI 0.7-2.13, I(2) = 88%). Side effects were more reported in the HCQ group than in the SC (RR = 3.14, 95% CI 1.58-6.24, I(2) = 0). Radiological improvement and clinical worsening were not statistically different between HCQ and SC [(RR = 1.11, 95% CI 0.74-1.65, I(2) = 45%) and (RR = 1.28, 95% CI 0.33-4.99), I(2) = 54%] respectively. Despite the scarcity of published data of good quality, the effectiveness and safety of either HCQ alone or in combination with AZM in treating COVID-19 cannot be assured. Future high-quality RCTs need to be carried out.PROSPERO registration: CRD42020192084."
The role of mesenchymal stem cells in COVID-19 treatment.,"The novel coronavirus (SARS-CoV-2) pandemic has created a sense of global panic and the medical community started to search for rapid answers. Pharmaceuticals and research labs across the world are racing to find vaccines and treatments for the new coronavirus, using a variety of different technological ways. With Coronavirus disease (COVID-19), it is observed that asymptomatic symptoms turn out to be severe and fatal. By raising pyrexia, sepsis, acute respiratory distress syndrome (ARDS), and multiple organ failure are observed to develop which are not only associated with coronavirus. The treatment of the virus and the systemic inflammatory response it causes are also very important. The rapid response to infection has been well defined and comprises a complex interaction of cytokine storm, endothelial dysfunction, inflammation, and pathologic coagulation. Since the effective therapies are missing and immunological treatments may be deficient, mesenchymal stem cells (MSCs), by reason of their potent immunomodulatory ability, can have useful results in order to prevent the cytokine storm and reduce morbidity and mortality for COVID-19. The aim of this article is to discuss the potential effect of MSCs types in COVID-19 infection without definite treatment."
Clinical outcomes of hospitalised patients with COVID-19 and chronic inflammatory and autoimmune rheumatic diseases: a multicentric matched cohort study.,"OBJECTIVES: The impact of inflammatory rheumatic diseases on COVID-19 severity is poorly known. Here, we compare the outcomes of a cohort of patients with rheumatic diseases with a matched control cohort to identify potential risk factors for severe illness. METHODS: In this comparative cohort study, we identified hospital PCR+COVID-19 rheumatic patients with chronic inflammatory arthritis (IA) or connective tissue diseases (CTDs). Non-rheumatic controls were randomly sampled 1:1 and matched by age, sex and PCR date. The main outcome was severe COVID-19, defined as death, invasive ventilation, intensive care unit admission or serious complications. We assessed the association between the outcome and the potential prognostic variables, adjusted by COVID-19 treatment, using logistic regression. RESULTS: The cohorts were composed of 456 rheumatic and non-rheumatic patients, in equal numbers. Mean age was 63 (IQR 53-78) years and male sex 41% in both cohorts. Rheumatic diseases were IA (60%) and CTD (40%). Most patients (74%) had been hospitalised, and the risk of severe COVID-19 was 31.6% in the rheumatic and 28.1% in the non-rheumatic cohort. Ageing, male sex and previous comorbidity (obesity, diabetes, hypertension, cardiovascular or lung disease) increased the risk in the rheumatic cohort by bivariate analysis. In logistic regression analysis, independent factors associated with severe COVID-19 were increased age (OR 4.83; 95% CI 2.78 to 8.36), male sex (1.93; CI 1.21 to 3.07) and having a CTD (OR 1.82; CI 1.00 to 3.30). CONCLUSION: In hospitalised patients with chronic inflammatory rheumatic diseases, having a CTD but not IA nor previous immunosuppressive therapies was associated with severe COVID-19."
